{
  "$schema": "https://json-schema.org/draft/2020-12/schema",
  "$id": "./alice-chapter-v.utterances.schema.json",
  "title": "Alice's Adventures in Wonderland — Chapter V utterances fixture",
  "description": "Schema for the demo caption-room utterance fixture derived from Alice's Adventures in Wonderland, Chapter V (Project Gutenberg eBook #11, public domain). Describes the timed, per-speaker spoken lines used to simulate live captioning in the demo room.",
  "type": "object",
  "properties": {
    "$schema": {
      "type": "string",
      "description": "Self-reference to this schema file."
    },
    "source": {
      "type": "object",
      "description": "Attribution and provenance information for the source text.",
      "properties": {
        "title": {
          "type": "string",
          "description": "Title of the source work."
        },
        "author": {
          "type": "string",
          "description": "Author of the source work."
        },
        "chapter": {
          "type": "string",
          "description": "Chapter title/label the utterances are drawn from."
        },
        "attribution": {
          "type": "string",
          "description": "Attribution statement for the source text."
        },
        "url": {
          "type": "string",
          "description": "URL to the source text."
        },
        "note": {
          "type": "string",
          "description": "Additional notes about how the fixture text was extracted or is intended to be used."
        }
      },
      "required": ["title", "author", "chapter", "attribution", "url", "note"],
      "additionalProperties": false
    },
    "timing": {
      "type": "object",
      "description": "Parameters used to derive/simulate the timing of utterances and caption progress.",
      "properties": {
        "wordsPerSecond": {
          "type": "number",
          "description": "Assumed speaking rate in words per second used to compute utterance durations."
        },
        "gapWithinTurnSeconds": {
          "type": "number",
          "description": "Gap in seconds inserted between consecutive utterances from the same speaker's turn."
        },
        "gapBetweenTurnsSeconds": {
          "type": "number",
          "description": "Gap in seconds inserted between utterances when the speaker changes."
        },
        "progressEmittedAtFractionOfDuration": {
          "type": "number",
          "description": "Fraction of an utterance's duration at which an in-progress caption update (progresstxt) is emitted."
        }
      },
      "required": [
        "wordsPerSecond",
        "gapWithinTurnSeconds",
        "gapBetweenTurnsSeconds",
        "progressEmittedAtFractionOfDuration"
      ],
      "additionalProperties": false
    },
    "speakers": {
      "type": "array",
      "description": "List of distinct speakers appearing in the utterances.",
      "items": {
        "type": "string",
        "enum": ["caterpillar", "alice", "pigeon"]
      }
    },
    "loop": {
      "type": "boolean",
      "description": "Whether the demo playback should loop back to the start after the last utterance."
    },
    "totalDurationSeconds": {
      "type": "number",
      "description": "Total duration in seconds of the full utterance sequence."
    },
    "utteranceCount": {
      "type": "integer",
      "description": "Total number of utterances in the utterances array."
    },
    "utterances": {
      "type": "array",
      "description": "Ordered list of timed spoken lines used to drive the demo caption playback.",
      "items": {
        "type": "object",
        "description": "A single timed utterance spoken by one of the enumerated speakers.",
        "properties": {
          "start": {
            "type": "number",
            "minimum": 0,
            "description": "Start time in seconds, relative to the beginning of playback."
          },
          "end": {
            "type": "number",
            "minimum": 0,
            "description": "End time in seconds, relative to the beginning of playback."
          },
          "speaker": {
            "type": "string",
            "enum": ["caterpillar", "alice", "pigeon"],
            "description": "The speaker of this utterance."
          },
          "spoken": {
            "type": "string",
            "minLength": 1,
            "description": "The full spoken line of dialogue."
          },
          "progresstxt": {
            "type": "string",
            "description": "Partial/in-progress text emitted mid-utterance to simulate live captioning; may be empty for very short utterances."
          }
        },
        "required": ["start", "end", "speaker", "spoken", "progresstxt"],
        "additionalProperties": false
      }
    }
  },
  "required": [
    "source",
    "timing",
    "speakers",
    "loop",
    "totalDurationSeconds",
    "utteranceCount",
    "utterances"
  ]
}
