{
  "$schema": "./alice-chapter-v.utterances.schema.json",
  "source": {
    "title": "Alice's Adventures in Wonderland",
    "author": "Lewis Carroll",
    "chapter": "Chapter V — Advice from a Caterpillar",
    "attribution": "Project Gutenberg eBook #11 (public domain).",
    "url": "https://www.gutenberg.org/files/11/11-h/11-h.htm#chap05",
    "note": "Spoken dialogue only, extracted from #chap05 up to where #chap06 begins. Text is in the public domain; this fixture is for local/dev caption playback."
  },
  "timing": {
    "wordsPerSecond": 3.0,
    "gapWithinTurnSeconds": 0.3,
    "gapBetweenTurnsSeconds": 0.8,
    "progressEmittedAtFractionOfDuration": 0.5
  },
  "speakers": ["caterpillar", "alice", "pigeon"],
  "loop": true,
  "totalDurationSeconds": 404.97,
  "utteranceCount": 121,
  "utterances": [
    {
      "start": 0.0,
      "end": 1.0,
      "speaker": "caterpillar",
      "spoken": "Who are you?",
      "progresstxt": "who are"
    },
    {
      "start": 1.8,
      "end": 4.47,
      "speaker": "alice",
      "spoken": "I—I hardly know, sir, just at present—",
      "progresstxt": "I hardly know sir just at"
    },
    {
      "start": 4.77,
      "end": 9.1,
      "speaker": "alice",
      "spoken": "at least I know who I was when I got up this morning,",
      "progresstxt": "at least I know who I was when I got"
    },
    {
      "start": 9.4,
      "end": 13.4,
      "speaker": "alice",
      "spoken": "but I think I must have been changed several times since then.",
      "progresstxt": "but I think I must have been changed"
    },
    {
      "start": 14.2,
      "end": 16.87,
      "speaker": "caterpillar",
      "spoken": "What do you mean by that? Explain yourself!",
      "progresstxt": "what do you mean by that"
    },
    {
      "start": 17.67,
      "end": 20.0,
      "speaker": "alice",
      "spoken": "I can't explain myself, I'm afraid, sir,",
      "progresstxt": "I can't explain myself I'm afraid"
    },
    {
      "start": 20.3,
      "end": 22.3,
      "speaker": "alice",
      "spoken": "because I'm not myself, you see.",
      "progresstxt": "because I'm not myself you"
    },
    {
      "start": 23.1,
      "end": 24.1,
      "speaker": "caterpillar",
      "spoken": "I don't see.",
      "progresstxt": "I don't"
    },
    {
      "start": 24.9,
      "end": 27.57,
      "speaker": "alice",
      "spoken": "I'm afraid I can't put it more clearly,",
      "progresstxt": "I'm afraid I can't put it more"
    },
    {
      "start": 27.87,
      "end": 30.87,
      "speaker": "alice",
      "spoken": "for I can't understand it myself to begin with;",
      "progresstxt": "for I can't understand it myself to"
    },
    {
      "start": 31.17,
      "end": 35.17,
      "speaker": "alice",
      "spoken": "and being so many different sizes in a day is very confusing.",
      "progresstxt": "and being so many different sizes in a day"
    },
    {
      "start": 35.97,
      "end": 36.97,
      "speaker": "caterpillar",
      "spoken": "It isn't.",
      "progresstxt": ""
    },
    {
      "start": 37.77,
      "end": 40.44,
      "speaker": "alice",
      "spoken": "Well, perhaps you haven't found it so yet,",
      "progresstxt": "well perhaps you haven't found it so"
    },
    {
      "start": 40.74,
      "end": 45.74,
      "speaker": "alice",
      "spoken": "but when you have to turn into a chrysalis—you will some day, you know—",
      "progresstxt": "but when you have to turn into a crystal is you will"
    },
    {
      "start": 46.04,
      "end": 48.37,
      "speaker": "alice",
      "spoken": "and then after that into a butterfly,",
      "progresstxt": "and then after that into a butter"
    },
    {
      "start": 48.67,
      "end": 52.34,
      "speaker": "alice",
      "spoken": "I should think you'll feel it a little queer, won't you?",
      "progresstxt": "I should think you'll feel it a little queer"
    },
    {
      "start": 53.14,
      "end": 54.14,
      "speaker": "caterpillar",
      "spoken": "Not a bit.",
      "progresstxt": "not a"
    },
    {
      "start": 54.94,
      "end": 57.27,
      "speaker": "alice",
      "spoken": "Well, perhaps your feelings may be different,",
      "progresstxt": "well perhaps your feelings may be"
    },
    {
      "start": 57.57,
      "end": 61.24,
      "speaker": "alice",
      "spoken": "all I know is, it would feel very queer to me.",
      "progresstxt": "all I know is it would feel very"
    },
    {
      "start": 62.04,
      "end": 63.37,
      "speaker": "caterpillar",
      "spoken": "You! Who are you?",
      "progresstxt": "you who are"
    },
    {
      "start": 64.17,
      "end": 67.84,
      "speaker": "alice",
      "spoken": "I think, you ought to tell me who you are, first.",
      "progresstxt": "I think you ought to tell me who you"
    },
    {
      "start": 68.64,
      "end": 69.64,
      "speaker": "caterpillar",
      "spoken": "Why?",
      "progresstxt": ""
    },
    {
      "start": 70.44,
      "end": 71.44,
      "speaker": "caterpillar",
      "spoken": "Come back!",
      "progresstxt": ""
    },
    {
      "start": 71.74,
      "end": 73.41,
      "speaker": "caterpillar",
      "spoken": "I've something important to say!",
      "progresstxt": "I've something important to"
    },
    {
      "start": 74.21,
      "end": 75.21,
      "speaker": "caterpillar",
      "spoken": "Keep your temper.",
      "progresstxt": "keep your"
    },
    {
      "start": 76.01,
      "end": 77.01,
      "speaker": "alice",
      "spoken": "Is that all?",
      "progresstxt": "is that"
    },
    {
      "start": 77.81,
      "end": 78.81,
      "speaker": "caterpillar",
      "spoken": "No.",
      "progresstxt": ""
    },
    {
      "start": 79.61,
      "end": 81.94,
      "speaker": "caterpillar",
      "spoken": "So you think you're changed, do you?",
      "progresstxt": "so you think you're changed"
    },
    {
      "start": 82.74,
      "end": 84.41,
      "speaker": "alice",
      "spoken": "I'm afraid I am, sir,",
      "progresstxt": "I'm afraid I am"
    },
    {
      "start": 84.71,
      "end": 87.04,
      "speaker": "alice",
      "spoken": "I can't remember things as I used—",
      "progresstxt": "I can't remember things as I"
    },
    {
      "start": 87.34,
      "end": 91.01,
      "speaker": "alice",
      "spoken": "and I don't keep the same size for ten minutes together!",
      "progresstxt": "and I don't keep the same sighs for ten"
    },
    {
      "start": 91.81,
      "end": 93.14,
      "speaker": "caterpillar",
      "spoken": "Can't remember what things?",
      "progresstxt": "can't remember what"
    },
    {
      "start": 93.94,
      "end": 97.61,
      "speaker": "alice",
      "spoken": "Well, I've tried to say \"How doth the little busy bee,\"",
      "progresstxt": "well I've tried to say how does the little busy"
    },
    {
      "start": 97.91,
      "end": 99.58,
      "speaker": "alice",
      "spoken": "but it all came different!",
      "progresstxt": "but it all came"
    },
    {
      "start": 100.38,
      "end": 102.38,
      "speaker": "caterpillar",
      "spoken": "Repeat, 'You are old, Father William,'",
      "progresstxt": "repeat you are old father"
    },
    {
      "start": 103.18,
      "end": 108.51,
      "speaker": "alice",
      "spoken": "\"You are old, Father William,\" the young man said, \"And your hair has become very white;",
      "progresstxt": "you are old father william the young man said and your"
    },
    {
      "start": 108.81,
      "end": 114.48,
      "speaker": "alice",
      "spoken": "And yet you incessantly stand on your head— Do you think, at your age, it is right?\"",
      "progresstxt": "and yet you incessantly stand on your head do you think"
    },
    {
      "start": 114.78,
      "end": 120.11,
      "speaker": "alice",
      "spoken": "\"In my youth,\" Father William replied to his son, \"I feared it might injure the brain;",
      "progresstxt": "in my youth father william replied to his son I feared"
    },
    {
      "start": 120.41,
      "end": 125.74,
      "speaker": "alice",
      "spoken": "But, now that I'm perfectly sure I have none, Why, I do it again and again.\"",
      "progresstxt": "but now that I'm perfectly sure I have none why I"
    },
    {
      "start": 126.04,
      "end": 131.37,
      "speaker": "alice",
      "spoken": "\"You are old,\" said the youth, \"as I mentioned before, And have grown most uncommonly fat;",
      "progresstxt": "you are old said the youth as I mentioned before and"
    },
    {
      "start": 131.67,
      "end": 137.0,
      "speaker": "alice",
      "spoken": "Yet you turned a back-somersault in at the door— Pray, what is the reason of that?\"",
      "progresstxt": "yet you turned a back somersault in at the door pray"
    },
    {
      "start": 137.3,
      "end": 143.63,
      "speaker": "alice",
      "spoken": "\"In my youth,\" said the sage, as he shook his grey locks, \"I kept all my limbs very supple",
      "progresstxt": "in my youth said the sage as he shook his grey"
    },
    {
      "start": 143.93,
      "end": 149.6,
      "speaker": "alice",
      "spoken": "By the use of this ointment—one shilling the box— Allow me to sell you a couple?\"",
      "progresstxt": "by the use of this ointment one shilling the box allow"
    },
    {
      "start": 149.9,
      "end": 155.57,
      "speaker": "alice",
      "spoken": "\"You are old,\" said the youth, \"and your jaws are too weak For anything tougher than suet;",
      "progresstxt": "you are old said the youth and your jaws are too"
    },
    {
      "start": 155.87,
      "end": 162.2,
      "speaker": "alice",
      "spoken": "Yet you finished the goose, with the bones and the beak— Pray, how did you manage to do it?\"",
      "progresstxt": "yet you finished the goose with the bones and the beak"
    },
    {
      "start": 162.5,